detloc,state,source,author,title,description,url
"CASSCNE","Nebraska","Omaha.com","By Alia Conley World-Herald staff writer","Four men accused of scalping tickets to Elite Eight basketball game","Four men were arrested by Omaha police Sunday on suspicion of scalping tickets to the Elite Eight basketball game at the CenturyLink Center.","http://www.omaha.com/news/crime/men-accused-of-scalping-tickets-to-elite-eight-basketball-game/article_5c844dc3-baef-5171-bd0a-c655918fc920.html"
"CASSCNE","Nebraska","Omaha.com","By Alia Conley World-Herald staff writer","Relatives of 3 motorcyclists killed in crash upset that Omaha woman is sentenced to probation","All actions and reactions have consequences, some more tragic than others.","http://www.omaha.com/news/crime/relatives-of-motorcyclists-killed-in-crash-upset-that-omaha-woman/article_2f4bf486-49b6-5dc7-b131-ad5b47bd1b4b.html"
"CASSCNE","Nebraska","Omaha.com","By Nancy Gaarder World-Herald staff writer","Nebraska doctor Allan Wilsey, 60, 'treated anybody, anytime, anywhere'","On Friday, Allan Wilsey died at age 60. Janice Wilsey said her husband’s death is a lesson for those still living that colonoscopies matter.","http://www.omaha.com/livewellnebraska/nebraska-doctor-allan-wilsey-treated-anybody-anytime-anywhere/article_73a28465-ee9d-59d4-913a-c7e73166e052.html"
"CLICONY","New York","Nypost.com","Tamar Lapin","Prison worker caught having sexual relationship with inmate","A female prison worker was busted for having a sexual relationship with an inmate at the same upstate New York prison where a lovesick “Shawskank” supervisor helped two murderers escape. Denise Prell, a civilian worker at Clinton Correctional Facility in Dann…","http://nypost.com/2017/10/05/prison-worker-caught-having-sexual-relationship-with-inmate/"
"CLICONY","New York","Nypost.com","Tamar Lapin","Son accused of murdering ex-judge caught up in sex scandal","A disgraced former Michigan judge — nicknamed “the Bill Clinton of Macomb County ” because of lurid sex scandals that hounded him on the bench — was slain by his son, police said. The body of James “Skip” Scandirito, 74, was discovered in the abandoned Ocean …","https://nypost.com/2018/04/11/son-accused-of-murdering-ex-judge-caught-up-in-sex-scandal/"
"CLICONY","New York","Syracuse.com","Catie O'Toole | cotoole@syracuse.com","Syracuse woman accused of stabbing husband in chest during fight - Syracuse.com","BBC News Syracuse woman accused of stabbing husband in chest during fight Syracuse.com SYRACUSE, N.Y. -- Syracuse police say they arrested a woman who stabbed her husband with a pocket knife during a fight early Sunday. Tamora Weatherly, 32, of Syracuse, was …","http://www.syracuse.com/crime/index.ssf/2018/04/syracuse_woman_accused_of_stabbing_husband_in_chest_during_fight.html"
"CLICONY","New York","Nypost.com","Jackie Salo","Teacher accused of sex romps with student during walkout","A married teacher in Oklahoma was arrested for allegedly having sex with a student amid the statewide teacher walkout. Keri Hoffman, 35, admitted to police Saturday that she had sex with a 15-year-old student before and after they attended a massive teacher r…","https://nypost.com/2018/04/09/teacher-accused-of-sex-romps-with-student-during-walkout/"
"CLICONY","New York","Nydailynews.com","ANDY CLAYTON","Florida woman charged with stalking NASCAR’s Tony Stewart","A Florida woman upset that NASCAR star Tony Stewart wouldn't sign an autograph for her has been charged with felony stalking.","http://www.nydailynews.com/sports/more-sports/florida-woman-charged-stalking-nascar-tony-stewart-article-1.3651099"
"CLICONY","New York","Nydailynews.com","RICH SCHAPIRO","Female upstate prison worker caught having sex with convict","A female prison worker has been busted for having sex with an inmate at an upstate penitentiary.","http://www.nydailynews.com/news/crime/female-upstate-prison-worker-caught-sex-convict-article-1.3543423"
"CLICONY","New York","Nypost.com","Bob Fredericks","Joe Arpaio running for Senate seat in Arizona","Sheriff Joe Arpaio, the polarizing immigration hardliner who was pardoned by President Trump over the summer, plans to run as a Republican for the Arizona Senate seat held by the retiring Jeff Flake. “I am running for the US Senate from the Great State of Ari…","https://nypost.com/2018/01/09/joe-arpaio-running-for-senate-seat-in-arizona/"
"CLICONY","New York","The New York Times","FARAH STOCKMAN","‘Yes, I’m Running as a Socialist.’ Why Candidates Are Embracing the Label in 2018","Anger at the outsize role played by wealth has ignited a surge in the number of people who identify openly as socialists, even in red states.","https://www.nytimes.com/2018/04/20/us/dsa-socialism-candidates-midterms.html"
"CLICONY","New York","Observer.com","Steve Cronin, Steve Cronin","NJ Politics Digest: The Fraught Relationship of the State’s 2 Top Democrats","It's no secret that Gov. Phil Murphy and Senate President Steve Sweeney don't seem to be getting along.","http://observer.com/2018/02/nj-politics-digest-fraught-relationship-states-2-top-democrats/"
"CLICONY","New York","The New York Times","JACEY FORTIN","A Photo of Billy the Kid Bought for $10 at a Flea Market May Be Worth Millions","This tintype shows what historians believe is a photo of outlaw Billy the Kid, second from left, and Pat Garrett, far right, taken in 1880.","https://www.nytimes.com/2017/11/16/us/billy-the-kid-photo.html"
"CLICONY","New York","The New York Times","J. DAVID GOODMAN","As Democrats Celebrate Wins, Queens Republicans Close In on an Upset","Robert F. Holden has a slight lead on the Councilwoman Elizabeth S. Crowley, a two-term Democratic incumbent, in the city’s only contest that is still too close to call.","https://www.nytimes.com/2017/11/10/nyregion/city-council-nyc-election-crowley-holden.html"
"CLICONY","New York","Observer.com","Steve Cronin, Steve Cronin","NJ Politics Digest: Will Trump Nix Gateway Funding For Political Payback?","President Trump is telling Republicans in the House of Representatives not to provide funding for the $12.9 billion Gateway tunnel project.","http://observer.com/2018/03/nj-politics-digest-will-trump-nix-gateway-funding-political-payback/"
"CLICONY","New York","Nydailynews.com","Alexis Grenell","Men in politics, jockeying to rescue women","Just three hours after the New Yorker unmasked Attorney General Eric Schneiderman as a violent sociopath...","http://www.nydailynews.com/opinion/men-politics-jockeying-rescue-women-article-1.3990998"
"CLICONY","New York","The New York Times","MONA CHAREN","Op-Ed Contributor: I’m Glad I Got Booed at CPAC","I spoke the truth for the sake of every conservative disgusted by what has happened to our movement.","https://www.nytimes.com/2018/02/25/opinion/im-glad-i-got-booed-at-cpac.html"
"CLICONY","New York","Nydailynews.com","Voice of the People","Oct. 31: Judith Clark, Kevin Spacey and taxis","Brookfield, Conn.: I disagree with the Daily News’ position that to parole Judith Clark would have been giving her some kind of “special","http://www.nydailynews.com/opinion/oct-31-judith-clark-kevin-spacey-taxis-article-1.3600029"
"DOCORNE","Nebraska","Omaha.com","By Christopher Burbach World-Herald staff writer","More people would be let out of jail while awaiting trial under Douglas County pilot program","The Douglas County Corrections Department, faced with a crowded and chronically understaffed jail, is leading the effort.","http://www.omaha.com/news/plus/more-people-would-be-let-out-of-jail-while-awaiting/article_0ba288e4-1972-51c9-9b7b-6701d403a587.html"
"DOCORNE","Nebraska","Omaha.com","By Christopher Burbach World-Herald staff writer","Douglas County corrections director says he'll retire; 'We’ve done... some innovative things'","Mark Foxall, 57, has been corrections director for seven years. He has worked for the Corrections Department for 18 years.","https://www.omaha.com/news/crime/douglas-county-corrections-director-says-he-ll-retire-we-ve/article_4f3ef340-48c5-5e93-9a62-9d4963c9c42f.html"
"DOCORNE","Nebraska","Omaha.com","By Cheyenne Rowe / World-Herald staff writer","Three Omahans are honored for advancing Martin Luther King Jr.’s vision","Deputy Omaha Police Chief Greg Gonzalez, Tanya Burnside with the Douglas County Department of Corrections and civil rights veteran Tommie Wilson were recognized Friday during the Living the Dream awards ceremony at the City-County Building.","http://www.omaha.com/news/metro/three-omahans-are-honored-for-advancing-martin-luther-king-jr/article_44a36619-534c-55b2-8bd1-6cc2117c4947.html"
"DOCORNE","Nebraska","Omaha.com","By Paul Hammel / World-Herald Bureau","Douglas County, La Vista-based company defend jail phone call fees","In a statement issued Friday, a spokeswoman for the Douglas County Department of Corrections said that the main reason it led the state is because it is the largest correctional facility in the state, with an average of 1,355 inmates.","http://www.omaha.com/news/nebraska/douglas-county-la-vista-based-company-defend-jail-phone-call/article_9cca822e-f2e2-52ff-9a98-b04cd628b434.html"
"DOCORNE","Nebraska","Omaha.com","By Nancy Gaarder / World-Herald staff writer","Woman found dead in Douglas County jail cell","A woman who had been jailed in Douglas County on suspicion of trespassing has died in her cell.","http://www.omaha.com/news/crime/woman-found-dead-in-douglas-county-jail-cell/article_1f7eec3a-a4ad-11e7-bc30-ffe469f1b2fd.html"
"DOCORNE","Nebraska","Omaha.com","By Christopher Burbach World-Herald staff writer","Douglas County Jail officers 'worn down' by mandatory overtime, union says","Mandatory overtime shifts are placing further stress on corrections officers at the Douglas County Jail — a staff that already is worn thin by a shortage of officers and an unusually high inmate population, union leaders say.","http://www.omaha.com/news/plus/douglas-county-jail-officers-worn-down-by-mandatory-overtime-union/article_dde223e0-3f0f-5904-922f-8edcc1f1f116.html"
"DOCORNE","Nebraska","Omaha.com","By Andrew J. Nelson / World-Herald staff writer","Douglas County inmate, 58, dies in custody after being transferred to hospice","A Douglas County inmate died Friday in custody. Charles McNeal, 58, convicted of three counts of sexual assault on a juvenile, was confined to hospice care at the time of his death.","http://www.omaha.com/news/crime/douglas-county-inmate-dies-in-custody-after-being-transferred-to/article_9f0b86a8-c0ef-11e7-b45b-9b29f65a780b.html"
"DOCORNE","Nebraska","Omaha.com","By Mara Klecker / World-Herald staff writer","Omaha police arrest 31-year-old man in connection with South Omaha slaying","Matthew Arnold was booked into the Douglas County Jail on suspicion of second-degree murder in connection with the slaying of Matthew E. Johnson.","http://www.omaha.com/news/crime/omaha-police-arrest--year-old-man-in-connection-with/article_f6bf715a-d848-576e-b4d6-a5c2aa832104.html"
"DOCORNE","Nebraska","Omaha.com","By Hailey Konnath World-Herald staff writer","Sarpy County takes first steps toward building new jail as overcrowding concerns linger","Exactly what a new jail will entail — its capacity, location, cost and funding — is up in the air. But the time frame is not. The project's wheels are already turning. A new facility could be up and running…","http://www.omaha.com/news/crime/sarpy-county-takes-first-steps-toward-building-new-jail-as/article_9d7c8cd6-2a96-5fe8-ac65-35761e7d1db6.html"
"DOCORNE","Nebraska","Omaha.com","By Paul Hammel World-Herald Bureau","Turnover at Nebraska prisons increases to 34 percent, despite state's efforts","Turnover for such workers rose to the highest in recent memory, 34 percent, up from 31 percent in 2016. Overtime expenses are also on pace to eclipse the $9.3 million spent during the 2016-17 fiscal year.","http://www.omaha.com/news/nebraska/turnover-at-nebraska-prisons-increases-to-percent-despite-state-s/article_c82b7da7-97dc-5a2c-9caf-6e0b60322f0f.html"
"DOCORNE","Nebraska","Omaha.com","By Emily Nitcher / World-Herald Bureau","Nebraska State Sen. Justin Wayne introduces bill to cap pay of local elected officials at $24,000","Wayne said there needs to be a discussion about how much officials at the local level are being paid, and whether the jobs the elected officials are doing should be considered part-time or full-time jobs.","http://www.omaha.com/news/legislature/nebraska-state-sen-justin-wayne-introduces-bill-to-cap-pay/article_eb863b55-e292-5c8b-9818-1d38ea12b2ef.html"
"DOCORNE","Nebraska","Omaha.com","By Joe Duggan World-Herald Bureau","Senator cites 'fiasco' – 59 calls between inmate and attorney were recorded – in pushing new bill","The incident illustrates the need for a law that would ban jails from recording attorney-client phone calls, State Sen. John McCollister said last weekcq during a hearing before Legislature's Judiciary Committee. The Omaha senator included the provision in Le…","http://www.omaha.com/news/plus/senator-cites-fiasco-calls-between-inmate-and-attorney-were-recorded/article_d2a5e9f3-b44b-5775-a29a-d23c36443142.html"
"DOCORNE","Nebraska","Omaha.com","World-Herald editorial","Editorial: A new year, and new goals, for our city, state and country","The calendar turn to 2018 offers new opportunities for those willing to seize them. Today we offer our New Year’s wishes for those in position to shape how the year unfolds:","http://www.omaha.com/opinion/editorial-a-new-year-and-new-goals-for-our-city/article_0dc33600-5dc8-5aa5-a52e-a31fae8957e4.html"
"DOCORNE","Nebraska","Omaha.com","Compiled By Dan Golden / World-Herald staff writer","Husker overhaul, State Patrol turmoil, downtown development and more of Nebraska's top stories of 2017","Beer sales to Native Americans. Prison riots. The Keystone XL pipeline. The list of top stories for 2017 includes its share of weighty and divisive subjects. Here are the news stories of the year, as selected by The World-Herald.","http://www.omaha.com/news/metro/husker-overhaul-state-patrol-turmoil-downtown-development-and-more-of/article_6b3f4706-c2d2-54d1-9483-22d4011da9af.html"
"DOCORNE","Nebraska","Omaha.com","Compiled By Dan Golden / World-Herald staff writer","Husker overhaul, patrol turmoil, downtown development and more of Nebraska's top stories of 2017","Beer sales to Native Americans. Prison riots. The Keystone XL pipeline. The list of top stories for 2017 includes its share of weighty and divisive subjects. Here are the news stories of the year, as selected by The World-Herald.","http://www.omaha.com/news/metro/husker-overhaul-patrol-turmoil-downtown-development-and-more-of-nebraska/article_6b3f4706-c2d2-54d1-9483-22d4011da9af.html"
"DOCORNE","Nebraska","Omaha.com","Compiled By Dan Golden / World-Herald staff writer","Husker overhaul, patrol turmoil, downtown development and more of The World-Herald's top stories of 2017","Beer sales to Native Americans. Prison riots. The Keystone XL pipeline. The list of top stories for 2017 includes its share of weighty and divisive subjects. Here are the news stories of the year, as selected by The World-Herald.","http://www.omaha.com/news/metro/husker-overhaul-patrol-turmoil-downtown-development-and-more-of-the/article_6b3f4706-c2d2-54d1-9483-22d4011da9af.html"
"ORANGFL","Florida","Naplesnews.com","Naples (Fla.) Daily News, Naples (Fla.) Daily News","After Hurricane Irma, widespread sewage leaks show utilities were unprepared","Contaminated floodwater, carrying bacteria from the sea and sewage, bubbled up from the pipes before settling into neighborhoods and living rooms southwest Florida.","http://www.naplesnews.com/story/weather/hurricanes/2017/09/23/after-hurricane-irma-widespread-sewage-leaks-show-utilities-were-unprepared/687100001"
"ORANGFL","Florida","Naplesnews.com","Naples (Fla.) Daily News, Patrick Riley, Naples (Fla.) Daily News","Florida hospitals learned lessons from recent mass shootings","Doctors and staff at the two Broward Health System hospitals were prepared for the carnage in part because of other recent mass shootings, officials said","https://www.naplesnews.com/story/news/crime/2018/02/15/florida-school-previous-mass-shootings-helped-hospitals-prepare-school-victims-parkland/341520002?utm_source=google&utm_medium=amp&utm_campaign=speakable"
"ORANGFL","Florida","Naplesnews.com","patrick.riley@naplesnews.com, Patrick Riley, patrick.riley@naplesnews.com; 239-263-4825","Florida school shooting: 'The next generation will never have to worry about this'","Students from Marjory Stoneman Douglas High School will travel to Tallahassee to speak with lawmakers about enacting stricter gun laws.","https://www.naplesnews.com/story/news/crime/2018/02/18/florida-shooting-marjory-stoneman-douglas-students-work-ban-ar-15-and-change-gun-laws/349727002?utm_source=google&utm_medium=amp&utm_campaign=speakable"
"ORANGFL","Florida","Naplesnews.com","alexi.cardona@naplesnews.com, Alexi C. Cardona, alexi.cardona@naplesnews.com; 239-403-6153","Florida school shooting: Military burial sought for JROTC 'hero'","Peter Wang died in his Junior Reserve Officers' Training Corps uniform while helping fellow students get to safety.","https://www.naplesnews.com/story/news/crime/2018/02/18/peter-wang-online-petition-died-hero-helping-students-stoneman-douglas-asks-military-funeral/349973002?utm_source=google&utm_medium=amp&utm_campaign=speakable"
"ORANGFL","Florida","Tcpalm.com","Jon Santucci","USF-bound football player overcame incredible odds","JaJuan Cherry's tumultuous early childhood turned around when he was adopted by the Tedders family. He will sign with South Florida once the early signing period begins Wednesday.","http://www.tcpalm.com/story/sports/high-school/2017/12/14/jajuan-cherry-finds-family-through-faith-and-football/945923001/"
"ORANGFL","Florida","Orlandosentinel.com","Stephen Ruiz, Steven Lemongello","Congressman Darren Soto's wife arrested at Walt Disney World - Orlando Sentinel","Orlando Sentinel Congressman Darren Soto's wife arrested at Walt Disney World Orlando Sentinel Amanda Soto, the wife of U.S. Rep. Darren Soto, was booked into the Orange County Jail late Sunday night on suspicion of disorderly intoxication. (Orange County Jai…","http://www.orlandosentinel.com/news/politics/political-pulse/os-darren-soto-wife-arrested-0402-story.html"
"ORANGFL","Florida","Orlandosentinel.com","Bianca Padró Ocasio, Michael Williams","Windermere High School on lockdown while deputies search buildings - Orlando Sentinel","Orlando Sentinel Windermere High School on lockdown while deputies search buildings Orlando Sentinel Windermere High School was placed on lockdown Wednesday in response to a “potentially violent situation” after messages were received, authorities said. Orang…","http://www.orlandosentinel.com/news/breaking-news/os-windermere-high-school-lockdown-20171115-story.html"
"ORANGFL","Florida","Orlandosentinel.com","Krista Torralva","Student kills self at Lake Minneola High School - Orlando Sentinel","CBS News Student kills self at Lake Minneola High School Orlando Sentinel A Lake Minneola High School student shot and killed himself outside the school Tuesday morning, school district officials said. The student died in the bus loop, Lake County Schools spo…","http://www.orlandosentinel.com/news/breaking-news/os-lake-minneola-student-shoots-self-20171114-story.html"
"ORANGFL","Florida","Orlandosentinel.com","Krista Torralva","Seminole County teacher accused of sexual relationship with student, arrest report says - Orlando Sentinel","Orlando Sentinel Seminole County teacher accused of sexual relationship with student, arrest report says Orlando Sentinel 30-year-old Jaclyn Truman was arrested and charged with two counts of lewd acts on a minor. Krista TorralvaContact ReporterOrlando Sentin…","http://www.orlandosentinel.com/news/breaking-news/os-teacher-arrested-student-relationship-20171020-story.html"
"ORANGFL","Florida","Orlandosentinel.com","Annie Martin","Attorney for UCF student accused of gang rape cites 'numerous' witnesses - Orlando Sentinel","Orlando Sentinel Attorney for UCF student accused of gang rape cites 'numerous' witnesses Orlando Sentinel The attorney for a University of Central Florida student accused of gang-raping a woman Friday night during an off-campus party says “no less than five”…","http://www.orlandosentinel.com/features/education/school-zone/os-ucf-student-bond-20180425-story.html"
"ORANGFL","Florida","Orlandosentinel.com","Gal Tziperman Lotan","Hurricane Irma caused delays in courts - Orlando Sentinel","Orlando Sentinel Hurricane Irma caused delays in courts Orlando Sentinel Courthouses statewide were closed as Hurricane Irma roared through Florida, but the justice system wasn't back to normal as soon as skies cleared. In the Florida Keys, which took a direc…","http://www.orlandosentinel.com/news/hurricane-irma-recovery/os-hurricane-irma-court-backlog-20170922-story.html"
"ORANGFL","Florida","Orlandosentinel.com","David Harris","Volusia County teacher had sex with 8th-grade boy, deputies say - Orlando Sentinel","Heavy.com Volusia County teacher had sex with 8th-grade boy, deputies say Orlando Sentinel A teacher at New Smyrna Beach Middle School was arrested Wednesday on charges that she was having sex with an eighth-grade boy, according to the Volusia County Sheriff'…","http://www.orlandosentinel.com/news/breaking-news/os-new-smyrna-middle-teacher-arrested-20180228-story.html"
"ORANGFL","Florida","Sun-sentinel.com","Adam Sacasa and Marc Freeman","Death penalty to be sought against woman accused in killer clown case - Sun Sentinel","Sun Sentinel Death penalty to be sought against woman accused in killer clown case Sun Sentinel Sheila Keen Warren is accused of being the killer clown in a 27-year-old murder case. Prosecutors are seeking the death penalty if convicted. Adam Sacasa and Marc …","http://www.sun-sentinel.com/local/palm-beach/fl-pn-clown-murder-jail-booking-20171002-story.html"
"ORANGFL","Florida","Orlandosentinel.com","Jeff Weiner, Gal Tziperman Lotan","Children killed in Orlando standoff: Gary Wayne Lindsey Jr. had history of violence, arrests - Orlando Sentinel","Orlando Sentinel Children killed in Orlando standoff: Gary Wayne Lindsey Jr. had history of violence, arrests Orlando Sentinel After being together for about five years and engaged for more than three, Gary Wayne Lindsey Jr.'s girlfriend broke up with him in …","http://www.orlandosentinel.com/news/breaking-news/os-children-dead-orlando-gary-wayne-lindsey-standoff-20180612-story.html"
"ORANGFL","Florida","Orlandosentinel.com","Jason Ruiter","Lady Lake dad drowned toddler because wife was divorcing him, deputies say - Orlando Sentinel","Orlando Sentinel Lady Lake dad drowned toddler because wife was divorcing him, deputies say Orlando Sentinel A 38-year-old Lady Lake man suspected in the death of his 17-month-old daughter this morning turned himself in, according to the Lake County Sheriff's…","http://www.orlandosentinel.com/news/lake/os-jeremy-main-kills-daughter-motive-20171010-story.html"
"ORANGFL","Florida","Sun-sentinel.com","Tonya Alanez","Killer clown unmasked after 27 years, Florida cops say","Death came knocking at Marlene Warren’s door disguised as a clown. And for 27 years the bizarre case of the Wellington clown murder remained unsolved — kind of; detectives had the alleged killer in their sights within three months of the slaying. It was a Sat…","http://www.sun-sentinel.com/local/palm-beach/fl-pn-wellington-clown-murder-arrest-20170926-story.html"
"ORANGFL","Florida","Orlandosentinel.com","Michael Williams","Woman sets ex-boyfriend on fire during Easter dinner...","When he asked Perez what was inside the container, she responded, “It’s gasoline, you son of a [expletive],” according to a police report.","http://www.orlandosentinel.com/news/breaking-news/os-altamonte-springs-easter-fire-20180403-story.html"
"ORANGFL","Florida","Sun-sentinel.com","Marc Freeman, Linda Trischitta","Killer clown takedown is final act in explosive love triangle, cops say - Sun Sentinel","Sun Sentinel Killer clown takedown is final act in explosive love triangle, cops say Sun Sentinel Sheila Keen Warren was arrested Tuesday in the 1990 shooting death of her husband Michael Warren's then-wife, 27 years after initially coming under suspicion by …","http://www.sun-sentinel.com/local/palm-beach/fl-pn-clown-murder-case-folo-20170927-story.html"
"ORANGFL","Florida","Sun-sentinel.com","David Fleshler, Paula McMahon, Lisa J. Huriash, Linda Trischitta","CONFESSES","Florida school shooting suspect Nikolas Cruz admitted his guilt to detectives, saying he escaped by blending into the crowd of fleeing students at a Parkland, Florida, high school.","http://www.sun-sentinel.com/local/broward/parkland/florida-school-shooting/fl-florida-school-shooting-main-20180215-story.html"
"ORANGFL","Florida","Tcpalm.com","Jon Santucci","USF-bound football player overcame incredible odds","JaJuan Cherry's tumultuous early childhood turned around when he was adopted by the Tedders family. He will sign with South Florida once the early signing period begins Wednesday.","http://www.tcpalm.com/story/sports/high-school/2017/12/14/jajuan-cherry-finds-family-through-faith-and-football/945923001/"
"SACITCA","California","Latimes.com","Hannah Fry","Hearing today will weigh what’s next for homeless moved from Santa Ana River trail and into area motels","The future of hundreds of homeless people recently removed from the Santa Ana River trail in Orange County and temporarily housed in area motels will be the focus of a federal judge's hearing Saturday in Santa Ana. More than 700 homeless people were moved las…","http://www.latimes.com/local/lanow/la-me-ln-oc-homeless-20180317-story.html"
