detloc,state,source,author,title,description,url
"PIC","Texas","Brownsvilleherald.com","FERNANDO DEL VALLE, Staff Writer","Port Isabel church to bless Oblate memorial","PORT ISABEL — In 1849, the Oblates Fathers of Mary Immaculate climbed off a boat to begin their long service to this seaside community.","https://www.brownsvilleherald.com/news/local/port-isabel-church-to-bless-oblate-memorial/article_414cc7cc-2e4a-5588-9896-ed16aa80072c.html"
"PIC","Texas","Brownsvilleherald.com","By Nadia Tamez-Robledo Staff writer","Suspects to be arraigned in Port Isabel election night fight","Cameron County Sheriff Omar Lucio said suspects in a Port Isabel election night fight outside City Hall are expected to be arraigned Wednesday afternoon. The Port Isabel Police Department asked his office to take over the investigation May 7, he said.","http://www.brownsvilleherald.com/news/local/suspects-to-be-arraigned-in-port-isabel-election-night-fight/article_60c7b1ca-5922-11e8-8596-17eb5ea84f73.html"
"PIC","Texas","Brownsvilleherald.com","By Diana Eva Maldonado, Staff writer","Police: Motorcyclist strikes, kills woman in Port Isabel","Port Isabel Police say a woman was killed Sunday night when she was struck by a motorcyclist who was speeding on the emergency lane of the city’s main road.","http://www.brownsvilleherald.com/news/local/police-motorcyclist-strikes-kills-woman-in-port-isabel/article_d5f9e700-209d-11e8-9722-9361e1452bcc.html"
"PIC","Texas","Brownsvilleherald.com","By Diana Eva Maldonado, Staff writer","Couple charged with child abuse, giving 5-month-old inhalant","Port Isabel Police arrested a couple they say sexually abused a baby and gave the infant an air inhalant.","http://www.brownsvilleherald.com/news/local/couple-charged-with-child-abuse-giving--month-old-inhalant/article_b44b5a14-1b2d-11e8-83d8-a7932e9d9e94.html"
"PIC","Texas","Brownsvilleherald.com","By Diana Eva Maldonado, Staff writer","Police: Suspects stole $7100 in electronics from Walmart stores","Port Isabel Police are searching for two suspects accused of stealing thousands of dollars in electronics from two area Walmart stores.","http://www.brownsvilleherald.com/news/local/police-suspects-stole-in-electronics-from-walmart-stores/article_3921306a-2e0c-11e8-b784-23870e27649c.html"
"PIC","Texas","Brownsvilleherald.com","By MARK REAGAN | Staff Writer","Lawsuit alleges housing discrimination in P.I.","A lawsuit filed in federal court late Monday afternoon alleges that city leaders in Port Isabel discriminated against low-income Hispanic residents in the years following Hurricane Dolly.","http://www.brownsvilleherald.com/news/local/lawsuit-alleges-housing-discrimination-in-p-i/article_b23a0488-c438-11e7-b7eb-170e5efb4e40.html"
"PIC","Texas","Brownsvilleherald.com","By Mark Reagan | Staff Writer","Former Port Isabel HS teacher accused of improper relationship with a student","The Precinct 1 Constable’s Office has arrested and charged a former Port Isabel High School coach and math teacher with having a sexual relationship with a student.","http://www.brownsvilleherald.com/news/local/former-port-isabel-hs-teacher-accused-of-improper-relationship-with/article_c34e2030-6a7b-11e8-a4b5-3342c6ca6356.html"
"PIC","Texas","Caller.com","Corpus Christi Caller Times, Beatriz Alvarado, Corpus Christi Caller Times","Plan to reunite immigrant families questioned by attorneys, advocates in Texas","\"I’m not saying it’s not happening. I’m saying that I haven’t seen it,\" said Ofelia Calderon, a Virginia-based civil rights attorney in Port Isabel, Texas.","https://www.caller.com/story/news/texasregion/2018/06/24/plan-reunite-immigrant-families-questioned-advocates-texas-family-separations/729433002?utm_source=google&utm_medium=amp&utm_campaign=speakable"
"PIC","Texas","Brownsvilleherald.com","By NADIA TAMEZ-ROBLEDO | Staff Writer","Early voting spots to change","Early voters in Port Isabel, Los Fresnos and Brownsville will head to new polling places for the March 6 primary. Cameron County commissioners approved the changes during last week’s meeting.","http://www.brownsvilleherald.com/premium/early-voting-spots-to-change/article_c3a6ab34-e9d3-11e7-9550-070cfc595fbb.html"
"PIC","Texas","Brownsvilleherald.com","By NADIA TAMEZ-ROBLEDO Staff Writer","Runners traverse causeway during fitness run, walk","After a run that started at Schlitterbahn and continued across the Queen Isabella Memorial Bridge, Norman Esquivel said he crossed the finish line in Port Isabel with a smile.","http://www.brownsvilleherald.com/premium/runners-traverse-causeway-during-fitness-run-walk/article_237e76de-66d1-11e8-92ad-c3ae1be29bcf.html"
"PIC","Texas","Brownsvilleherald.com","By LAURA B. MARTINEZ Staff Writer","Easter egg hunts taking place in Cameron County","With Easter about a week away, local organizations and stores will be holding Easter Egg hunts for the little ones this weekend.","http://www.brownsvilleherald.com/news/local/easter-egg-hunts-taking-place-in-cameron-county/article_088153fa-2de8-11e8-a610-8322c773ca98.html"
"PIC","Texas","Brownsvilleherald.com","By Diana Eva Maldonado, Staff writer","Anglers banned from fishing during freezing weather","The freezing weather has forced Texas Parks and Wildlife Department to issue a temporary closure to saltwater fishing in the Valley and other counties along the Texas Gulf coast.","http://www.brownsvilleherald.com/news/local/angers-banned-from-fishing-during-freezing-weather/article_654ff28e-ef23-11e7-b6e6-cbde25d8303f.html"
"PIC","Texas","Brownsvilleherald.com","MARK REAGAN Staff Writer","Auto-pedestrian accident in Brownsville leaves two sisters dead","Note: This story has been updated from its original version","http://www.brownsvilleherald.com/news/local/auto-pedestrian-accident-in-brownsville-leaves-two-sisters-dead/article_4433760e-285b-11e8-a1d7-53756ee8db33.html"
"PIC","Texas","Brownsvilleherald.com","MARK REAGAN, Staff Writer","New York woman, son make trek to Casa Presidente","Ashley Casale and her 7-year-old son, Gabriel, drove nearly 2,000 miles after the school year ended last Friday in New York to the Rio Grande Valley to see for herself the impact of President Donald Trump’s zero-tolerance policy and how family separations are…","https://www.brownsvilleherald.com/premium/new-york-woman-son-make-trek-to-casa-presidente/article_ad24a3d6-0d7a-538d-b55e-891023e7f7bd.html"
"PIC","Texas","Brownsvilleherald.com","Staff report","Find out where you can vote today in Cameron County","The following is a list of Democratic polling places in Cameron County for today's primary election:","http://www.brownsvilleherald.com/news/local/find-out-where-you-can-vote-today-in-cameron-county/article_5e78d954-20cd-11e8-a453-6fce8c9c3932.html"
"PIC","Texas","Brownsvilleherald.com","By STEVE CLARK | Staff Writer","CAF-RGV Wing packing up after 26 years in Brownsville","A handful of volunteers are packing 26 years of accumulated stuff into boxes at the soon-to-be-former Commemorative Air Force headquarters and aviation museum at the Brownsville South Padre Island International Airport.","http://www.brownsvilleherald.com/premium/caf-rgv-wing-packing-up-after-years-in-brownsville/article_eb1e507a-b929-11e7-b78a-77e5e5ccbfa5.html"
"PIC","Texas","Brownsvilleherald.com",null,"Early voting locations and state constitutional amendments","The following is a list of state constitutional amendments that will be on the Nov. 7 ballot:","http://www.brownsvilleherald.com/news/local/early-voting-locations-and-state-constitutional-amendments/article_6209eb7a-b922-11e7-be90-ef6379c6a031.html"
"PIC","Texas","Brownsvilleherald.com","STEVE CLARK | STAFF WRITER","CAF-RGV Wing packing up after 26 years in Brownsville","A handful of volunteers are packing 26 years of accumulated stuff into boxes at the soon-to-be-former Commemorative Air Force headquarters and aviation museum at the Brownsville South Padre Island International Airport.","http://www.brownsvilleherald.com/news/local/caf-rgv-wing-packing-up-after-years-in-brownsville/article_59489d12-b92a-11e7-ba96-5b84a7205ef1.html"
"PIC","Texas","Brownsvilleherald.com","MARK REAGAN Staff Writer","Court sentences man to decade in prison for drunk driving death","A Brownsville man will spend a decade in prison for drunken driving that resulted in the death of a passenger during an early morning accident in 2016, according to court documents.","http://www.brownsvilleherald.com/news/local/court-sentences-man-to-decade-in-prison-for-drunk-driving/article_fd3ce23c-c0cf-11e7-bed0-97a79d702dda.html"
"PIC","Texas","Brownsvilleherald.com","By STEVE CLARK Staff Writer","First cruise study is positive; Analysis: SPI has attributes necessary to attract industry","A preliminary study from SPI Cruise Group, a consortium of cruise industry experts evaluating South Padre Island’s potential as a port of call, concludes that the Island is, in fact, well-positioned to attract cruise ships.","http://www.brownsvilleherald.com/premium/first-cruise-study-is-positive-analysis-spi-has-attributes-necessary/article_f23110b0-12ce-11e8-bcb6-4b48a746db21.html"
"PIC","Texas","Dallasnews.com","Wire Services","About 500 kids reunited with families since May, Trump official says","A senior Trump administration official says about 500 of the more than 2,000 children separated from their families at the border have been...","https://www.dallasnews.com/news/immigration/2018/06/21/500-kids-reunited-families-since-may-trump-official-says"
"PIC","Texas","Caller.com","Corpus Christi Caller-Times, Natalia E Contreras, Corpus Christi Caller-Times","Here's where to get your H-E-B Selena bag","The limited edition Selena reusable bags are available at H-E-B stores and online at www.heb.com.","http://www.caller.com/story/entertainment/2018/03/02/heb-selena-bag/388258002?utm_source=google&utm_medium=amp&utm_campaign=speakable"
"PIC","Texas","Dallasnews.com","Dianne Solis","Nonprofit says it has data that can help reunite 2,000 immigrant children","A nonprofit that administers a program offering legal guidance in shelters for immigrant minors has created a database that could help more than...","https://www.dallasnews.com/news/immigration/2018/06/29/nonprofit-says-data-can-help-reunite-2000-immigrant-children"
"PIC","Texas","Brownsvilleherald.com","MARK REAGAN | STAFF WRITER","Cameron County raises RV fees at Isla Blanca to fund improvements","SOUTH PADRE ISLAND — Sherry and Richard Fry were relaxing in lawn chairs on a sunny Wednesday morning in the RV park at Isla Blanca Park.","http://www.brownsvilleherald.com/premium/county-officials-raise-rv-fees-at-isla-blanca-to-fund/article_6de555e8-ccc2-11e7-bb25-2fa90f4d678b.html"
"PIC","Texas","Themonitor.com","NADIA TAMEZ-ROBLEDO | STAFF WRITER","Lighthouse reopens after months of delays","PORT ISABEL — For anyone who’s missed the view from atop the Port Isabel Lighthouse, the wait is finally over.","http://www.themonitor.com/news/local/article_0a47b452-ef51-11e7-9914-dff5df58a1a3.html"
"PIC","Texas","Themonitor.com","NADIA TAMEZ-ROBLEDO | STAFF WRITER","Port Isabel celebrates grand reopening of lighthouse","PORT ISABEL — As a lifelong Rio Grande Valley resident, Valerie Barrientos of La Feria has long wanted to climb the historic steps of the Port Isabel Lighthouse. It was still closed when she visited in September, at the tail-end…","http://www.themonitor.com/news/local/article_ab21e3be-0119-11e8-a4af-8b4ed96581ed.html"
"PIC","Texas","Themonitor.com","MARK REAGAN | STAFF WRITER","Lawsuit alleges housing discrimination in Port Isabel","A lawsuit filed in federal court late Monday afternoon alleges that city leaders in Port Isabel discriminated against low-income Hispanic residents in the years following Hurricane Dolly.","http://www.themonitor.com/news/local/article_de72fb22-c49c-11e7-bf0d-fb3e41660ee3.html"
"PIC","Texas","Themonitor.com","RAUL GARCIA | STAFF WRITER","Port Isabel woman dies after being hit by motorcyclist","PORT ISABEL — Elizabeth Sweeten could often be seen walking around town.","http://www.themonitor.com/news/local/article_741687ea-20ee-11e8-b9c2-5fd458b493bf.html"
"PIC","Texas","Themonitor.com","NADIA TAMEZ-ROBLEDO | STAFF WRITER","Port Isabel hands Yacht Club restoration to new buyer","Port Isabel officials’ plans to rehabilitate the historic Yacht Club Hotel came to a close in February, when the city sold the building to a local family.","http://www.themonitor.com/news/local/article_a976864c-2af8-11e8-ac4d-ff32563e761a.html"
"PIC","Texas","Themonitor.com","MARK REAGAN | STAFF WRITER","Former Port Isabel HS teacher accused of improper relationship with student","The Precinct 1 Constable’s Office has arrested and charged a former Port Isabel High School coach and math teacher with having a sexual relationship with a student.","https://www.themonitor.com/news/local/article_931e2884-6b29-11e8-9148-8f1b7bc63025.html"
"PIC","Texas","Themonitor.com","KAILA CONTRERAS | STAFF WRITER","Falcon, kite released after recovering at Gladys Porter Zoo","After being cared for and rehabilitated by the Gladys Porter Zoo veterinary staff since late August, a peregrine falcon and a white-tailed kite were released Wednesday back into the wild at the intersection of Old Port Isabel Road and Highway…","http://www.themonitor.com/news/local/article_d295a1d8-b4ca-11e7-9edb-8f604b0a15f7.html"
"PIC","Texas","Themonitor.com","ELLIOT SPAGAT and EMILY SCHMALL | THE ASSOCIATED PRESS","Attorneys: Parents in fragile state for asylum interviews","LOS FRESNOS — Gabriel Canas, a bus driver from El Salvador who fled his homeland after members of MS-13 stormed his bus, did an initial screening interview for asylum under the worst circumstances.","https://www.themonitor.com/news/local/article_0477df96-7fb8-11e8-9064-17d1ebdb3c6c.html"
"PIC","Texas","Themonitor.com","MARK REAGAN | STAFF WRITER","LNG opponents deliver public comment to TCEQ","Opponents of the proposed Rio Grande liquefied-natural gas pipeline near South Padre Island delivered nearly 2,000 public comments on Monday to the Texas Commission on Environmental Quality headquarters in Austin.","http://www.themonitor.com/news/local/article_aa542950-31c6-11e8-a053-eb9149dae495.html"
"PIC","Texas","Themonitor.com","DIANA EVA MALDONADO | STAFF WRITER","Anglers banned from local fishing spots because of freezing weather","The freezing weather has forced Texas Parks and Wildlife Department to issue a temporary closure to saltwater fishing in the Rio Grande Valley and other counties along the Texas Gulf coast.","http://www.themonitor.com/news/local/article_fe4604ac-ef27-11e7-82a1-2328bebfece5.html"
"PIC","Texas","Themonitor.com","STAFF REPORT","Update: New UIL district alignments announced","The following are the new local Class 6A district alignments:","http://www.themonitor.com/news/local/article_a7b8d760-0762-11e8-af30-77afc9953513.html"
"PIC","Texas","Themonitor.com","STAFF REPORT","Monitor names new deputy editor in editorial restructure","McALLEN — The Monitor has promoted a Rio Grande Valley journalist and seasoned newsroom leader to, together with the newspaper’s publisher, oversee its editorial coverage.","http://www.themonitor.com/news/local/article_336d6dfe-f02d-11e7-a4c5-57a70c7ca36f.html"
"PIC","Texas","Themonitor.com","RICK KELLEY | STAFF WRITER","Gale force winds bring weather alert for Valley coastal areas","HARLINGEN — Weather forecasters have issued a wind advisory beginning at 3 p.m. this afternoon when a strong cold front is expected to rocket into the Rio Grande Valley.","http://www.themonitor.com/news/local/article_8365c324-bb3a-11e7-a0fe-ef36d33bd6a2.html"
"PIC","Texas","Themonitor.com","NADIA TAMEZ-ROBLEDO | STAFF WRITER","Isla Blanca Park boat ramp to close","The Isla Blanca Park boat ramp, nearby restrooms and parking lot will close March 1 as construction of an amphitheater and multipurpose building in the Dolphin Cove area continues.","http://www.themonitor.com/news/local/article_8a28b32c-1a8c-11e8-a05b-77f620a633f4.html"
"PIC","Texas","Themonitor.com","STAFF REPORT","McAllen sees second-straight monthly sales tax gain","The first sales tax allocation of 2018 shows McAllen with its second straight strong monthly showing.","http://www.themonitor.com/news/business/article_d1d0fc94-f8df-11e7-9f61-cbc6d5dbc5c1.html"
"PIC","Texas","Themonitor.com","BY MARK REAGAN | STAFF WRITER","Wait and See: Officials monitoring South Padre Island for fish kills","State and local authorities are still waiting to see whether cold temperatures will result in a fish kill on South Padre Island.","http://www.themonitor.com/news/local/article_1eb46220-f02b-11e7-b32e-fbcc5245b35f.html"
"PIC","Texas","Themonitor.com","MARK MORENO | STAFF WRITER","End of the trail: Riders preserve tradition in journey to livestock show parade","MERCEDES — Despite the expansion of the Rio Grande Valley Livestock Show and Rodeo schedule to a Thursday start, the Saturday parade for many officially marks the start of the festivities.","http://www.themonitor.com/news/local/article_48a73f7e-24da-11e8-84ea-efaedc23efa6.html"
"PIC","Texas","Themonitor.com","STEVE CLARK | STAFF WRITER","Federal monitoring program will track foreign shrimp imports","A decision by Congress to add imported shrimp to the Seafood Import Monitoring Program is good news for an industry not used to hearing good news.","http://www.themonitor.com/news/local/article_6ed8e294-3603-11e8-9f8c-630577e6377a.html"
"PIC","Texas","Themonitor.com","MARK REAGAN | STAFF WRITER","New York Woman, son make trek to Casa Presidente","BROWNSVILLE - Ashley Casale and her 7-year-old son, Gabriel, drove nearly 2,000 miles after the school year ended last Friday in New York to the Rio Grande Valley to see for herself the impact of President Donald Trump’s zero-tolerance policy…","https://www.themonitor.com/news/local/article_d0b9e63a-7c11-11e8-96e9-8f06e807d015.html"
"PIC","Texas","Themonitor.com","MARK MORENO | STAFF WRITER","Photographer, Author Hopes To Educate Community Through Work","MCALLEN – Deval “Pino” Shah lives his life surrounded by what he describes as blessings. At 53 years old, dressed in a crisp white shirt, blue jean shorts and sandals, a passerby might notice him with a digital camera to…","http://www.themonitor.com/news/local/article_dd8598da-4117-11e8-befe-4f73b9adafcd.html"
"PIC","Texas","Themonitor.com","LORENZO ZAZUETA-CASTRO | STAFF WRITER","New prosecutors, immigration judges added for border","McALLEN — The Department of Justice announced Wednesday the addition of 35 new assistant U.S. attorneys to offices along the U.S.-Mexico border.","http://www.themonitor.com/news/immigration/article_bccd9772-4f4b-11e8-917b-a75ab8bdf136.html"
"PIC","Texas","Themonitor.com","MITCHELL FERMAN | STAFF WRITER","Bipartisan congressional group to visit Valley to examine family separations","A bipartisan congressional group is scheduled to visit the Rio Grande Valley on Monday, which will mark the first Republicans aside from the two Texas senators to explore the region since the Trump administration’s “zero-tolerance\" policy was publicly rolled …","https://www.themonitor.com/news/local/article_d163351a-8165-11e8-ae1d-57c518ff2e80.html"
"PIC","Texas","Themonitor.com","J. EDWARD MORENO | STAFF WRITER","Fracking activist tries to gauge power plant emissions","EDINBURG — Sharon Wilson stood in a lecture hall at the University of Texas Rio Grande Valley Tuesday with two side-by-side photos of a local power plant on the projector. What followed were gasps from the roughly 70 students in…","http://www.themonitor.com/news/local/article_4a613120-3494-11e8-95cf-1be51060ceab.html"
"PIC","Texas","Themonitor.com","MARK MORENO | STAFF WRITER","Thousands enjoy a warm H-E-B holiday meal","MCALLEN – Empty stomachs and a mouth-watering meal met Sunday for the 27th annual H-E-B Feast of Sharing held at the Convention Center.","http://www.themonitor.com/news/article_f27477fa-c815-11e7-94ae-47adf21f4541.html"
"PIC","Texas","Themonitor.com","CRISTINA M. GARCIA | STAFF WRITER","Resilience tested: Family coping with father’s deportation, now struggles with leukemia diagnosis","DONNA — Jaquelyne Chacon had been taken to the emergency room at Knapp Medical Center in Weslaco because of an overwhelming pain in her joints and extreme fatigue on Oct. 5. She was diagnosed with acute lymphoblastic leukemia the following…","http://www.themonitor.com/news/local/article_0dc5db1c-d24c-11e7-be27-9b0e0caefc77.html"
"PIC","Texas","Themonitor.com","LORENZO ZAZUETA-CASTRO | STAFF WRITER Follow @lorenzozazueta !function(d,s,id){var js,fjs=d.getElementsByTagName(s)[0],p=/^http:/.test(d.location)?'http':'https';if(!d.getElementById(id)){js=d.createElement(s);js.id=id;js.src=p+'://platform.twitter.com/widgets.js';fjs.parentNode.insertBefore(js,fjs);}}(document, 'script', 'twitter-wjs');","Valley man sues DHS for racial discrimination","In a lawsuit filed against the U.S. Department of Homeland Security in federal court last week, a Brownsville man claims his employee security clearance was rescinded because of where he was born.","http://www.themonitor.com/news/immigration/article_67e96eee-16b5-11e8-b5d0-632633ef0845.html"
"PIC","Texas","Themonitor.com","WILL WEISSERT and ELLIOT SPAGAT | THE ASSOCIATED PRESS","At hub for border crossings, families spread throughout US","McALLEN — Manuel Martinez, who fled Honduras because gangs were trying to recruit his 12-year-old son, was prepared to be separated from his child after paying a smuggler to cross the Rio Grande by boat and getting arrested by the…","https://www.themonitor.com/news/local/article_ce26256e-77f2-11e8-91f5-53a2a6e0681d.html"
"PIC","Texas","Themonitor.com","MARK MORENO | STAFF WRITER","Protesters demand family reunification","McALLEN — Protesters rallied Saturday to decry the separation of immigrant parents from their children by U.S. border authorities, while Democratic lawmakers said they aren't convinced the Trump administration has any real plan to reunite them.","https://www.themonitor.com/news/immigration/article_5b8af182-7762-11e8-a1fa-ff761219428d.html"
"PIC","Texas","Mysanantonio.com",null,"Texas Fishing Report - mySanAntonio.com","The weekly fishing report as compiled for the Texas Parks and Wildlife Department for Sept. 27 and also available on the internet at http://www.txfishing.com :\nCENTRAL\nBASTROP: Water stained; 83-87 degrees. Black bass are good on green pumpkin soft plastic wo…","http://www.mysanantonio.com/news/texas/article/Texas-Fishing-Report-12235051.php"
"PIC","Texas","Mysanantonio.com",null,"Texas Fishing Report - mySanAntonio.com","The weekly fishing report as compiled for the Texas Parks and Wildlife Department for Oct. 18 and also available on the internet at http://www.txfishing.com:\nCENTRAL\nAUSTIN: Water stained; 68-78 degrees; 0.8 feet low. Black bass are fair on Texas rigs, square…","http://www.mysanantonio.com/sports/article/Texas-Fishing-Report-12288540.php"
"PIC","Texas","Chron.com","By J.P. GREESON, For The Associated Press","Texas Fishing Report - Houston Chronicle - Chron.com","The weekly fishing report as compiled for the Texas Parks and Wildlife Department for Oct. 18 and also available on the internet at http://www.txfishing.com:\nCENTRAL\nAUSTIN: Water stained; 68-78 degrees; 0.8 feet low. Black bass are fair on Texas rigs, square…","http://www.chron.com/sports/article/Texas-Fishing-Report-12288540.php"
"PIC","Texas","Chron.com","Mike Hixenbaugh, Lomi Kriel","Protests continue as Trump administration moves to reunite separated families - Chron.com","Kristen Ruiz has never thought of herself as an activist. But one night last week, as the stay-at-home mother of three  rocked her 17-month-old  to sleep, she was overcome with sadness and anger at the thought of the government taking her children from her.\nS…","https://www.chron.com/news/houston-texas/houston/article/Protests-continue-as-Trump-administration-moves-13022377.php"
"DAVIDTN","Tennessee","Tennessean.com","USA TODAY NETWORK - Tennessee, USA TODAY NETWORK - Tennessee","Davidson County deputy seriously injured in crash","Sheriff Daron Hall asked for prayers.","http://www.tennessean.com/story/news/local/davidson/2018/01/01/davidson-county-deputy-seriously-injured-crash/994968001/"
"DAVIDTN","Tennessee","Tennessean.com","USA Today Network - Tennessee, USA Today Network - Tennessee","Nashville Sheriff Daron Hall to run for re-election in 2018","Davidson County Sheriff Daron Hall says he plans to run for reelection next year as he seeks a fifth term.","http://www.tennessean.com/story/news/2017/11/09/nashville-sheriff-daron-hall-run-re-election-2018/850136001/"
"DAVIDTN","Tennessee","Tennessean.com","USA Today Network - Tennessee, Joey Garrison, USA Today Network - Tennessee","Sheriff Daron Hall won't run for Nashville mayor, endorses David Briley","Davidson County Sheriff Daron Hall says he won't run for mayor of Nashville in the August election and is instead putting his support behind Mayor David Briley.","https://www.tennessean.com/story/news/2018/03/23/sheriff-daron-hall-wont-run-nashville-mayor-endorses-david-briley/453075002/?utm_source=google&utm_medium=amp&utm_campaign=speakable"
"DAVIDTN","Tennessee","Tennessean.com","USA TODAY NETWORK – Tennessee, Adam Tamburin, USA TODAY NETWORK – Tennessee","Nashville judges agree to push forward with plan to release more inmates without bail","Nashville's top prosecutor, the public defender and the Davidson County sheriff have been negotiating an overhaul of the program for months.","https://www.tennessean.com/story/news/2018/02/07/nashville-bail-reform-money-judges/317283002/?utm_source=google&utm_medium=amp&utm_campaign=speakable"
