detloc,state,source,author,title,description,url
"RGRNDTX","Texas","Themonitor.com","NOMAAN MERCHANT and ANITA SNOW | THE ASSOCIATED PRESS","'Papa! Papa!' Audio of children stokes rage over separation","","https://www.themonitor.com/news/local/article_c275939c-73d5-11e8-9b5a-17f66f2179dc.html"
"RGRNDTX","Texas","Themonitor.com","LORENZO ZAZUETA-CASTRO | STAFF WRITER","A rally for Santa Ana","ALAMO — More than 600 people gathered to celebrate the legacy of an historic refuge and simultaneously protest what environmentalists say is the federal government’s bid to irreparably damage it.","http://www.themonitor.com/news/local/article_4b460dbc-03c6-11e8-b66a-9f3d5377c791.html"
"RGRNDTX","Texas","Themonitor.com","BIANCA MUJICA | STAFF WRITER","Activists fast, pray for end to separation program","In reaction to the Trump administration’s “zero-tolerance” policy that led to the separation of immigrant families, the local chapter of the civil rights organization LUPE is leading a nearly monthlong hunger strike and prayer chain called Break Bread, Not Fa…","https://www.themonitor.com/news/immigration/article_c0260ca6-7ceb-11e8-a2df-d3316a0e60d9.html"
"BERGENJ","New Jersey","Nj.com","Ron Zeitlinger | The Jersey Journal","Bergen man charged with trying to steal from Secaucus store: police","A Bergen County man was caught trying to shoplift at the Home Depot in Secaucus, town police said.","http://www.nj.com/hudson/index.ssf/2018/02/bergen_man_charged_with_trying_to_steal_from_secau.html"
"BERGENJ","New Jersey","Nj.com","Caitlin Mota | The Jersey Journal","Inmate found hanging inside Hudson County jail","A 34-year-old woman was found hanging early yesterday morning inside the Hudson County jail, officials said.","http://www.nj.com/jjournal-news/index.ssf/2018/01/inmate_found_hanging_inside_hu.html"
"BERGENJ","New Jersey","Nj.com","Caitlin Mota | The Jersey Journal","Inmate found hanging inside Hudson County jail","A 34-year-old woman was found hanging early Sunday morning inside the Hudson County jail, officials said.","http://www.nj.com/hudson/index.ssf/2018/01/inmate_found_hanging_inside_hudson_county_jail.html"
"BERGENJ","New Jersey","Nj.com","Taylor Tiamoyo Harris | NJ Advance Media for NJ.com","Real estate agent who client money sent to prison, has to pay back over $300K","A Bergen County Superior Court judge sentenced Peter Live to five years in prison.","http://www.nj.com/bergen/index.ssf/2018/05/real_estate_agent_who_stole_down_payments_gets_jai.html"
"BERGENJ","New Jersey","Nj.com","Allison Pries | NJ Advance Media for NJ.com","2 arrested with $10K worth of heroin, prosecutor says","Two Paterson men were arrested with $10,000 worth of heroin after an undercover investigation.","http://www.nj.com/bergen/index.ssf/2017/11/undercover_cops_make_10000_heroin_bust.html"
"BERGENJ","New Jersey","Nj.com","Chris Sheldon | NJ Advance Media for NJ.com","Rabbi charged with sexually assaulting boy in 1999","A former Woodcliff Lake rabbi has been charged with sexually assaulting a boy in 1999, according to the Bergen County Prosecutor's Office.","http://www.nj.com/news/index.ssf/2018/03/rabbi_charged_with_sexually_assaulting_boy_in_1999.html"
"BERGENJ","New Jersey","Nj.com","Anthony G. Attrino | NJ Advance Media for NJ.com","Man charged with threat to blow up N.J. courthouse","Christopher Camargo, 25, of Hackensack is accused of concealing his phone number when he called police and made the bomb threat","http://www.nj.com/bergen/index.ssf/2018/05/man_charged_with_threat_to_blow_up_bergen_county_c.html"
"BERGENJ","New Jersey","Nj.com","Michaelangelo Conte | The Jersey Journal","$750K in high-grade marijuana seized, man charged: authorities","A North Bergen man has been arrested and 200 pounds of high grade marijuana seized following an investigation by the Hudson County Prosecutor's office which also recovered $100,000.","http://www.nj.com/hudson/index.ssf/2017/11/north_bergen_man_arrested_and_750k_worth_of_mariju.html"
"BERGENJ","New Jersey","Nj.com","Michaelangelo Conte | The Jersey Journal","Union City man caught driving car stolen in Weehawken: cops","A Union City man was arrested in North Bergen on Saturday where police say he was driving a car reported stolen in Weehawken a few days earlier.","http://www.nj.com/jjournal-news/index.ssf/2018/04/union_city_man_caught_driving.html"
"BERGENJ","New Jersey","Courierpostonline.com","(Cherry Hill, N.J.) Courier-Post, Jim Walsh, (Cherry Hill, N.J.) Courier-Post","Doctor accused of having wife killed to protect drug ring commits suicide","Dr. James Kauffman is the fifth death in eight months at the county jail where he was awaiting trial.","https://www.courierpostonline.com/story/news/crime/2018/01/26/kauffman-suicide-hudson-county-jail/1069719001?utm_source=google&utm_medium=amp&utm_campaign=speakable"
"BERGENJ","New Jersey","Nj.com","Caitlin Mota | The Jersey Journal","Inmate dies two days after attempting suicide","A woman who attempted suicide at the Hudson County jail over the weekend has died, officials said.","http://www.nj.com/jjournal-news/index.ssf/2018/01/inmate_dies_two_days_after_att.html"
"BERGENJ","New Jersey","Nj.com","Michaelangelo Conte | The Jersey Journal","Security cameras have their revenge after men try smashing them: police","North Bergen police say they used security video to track down two Jersey City men arrested on charges they stole security cameras form a dumpsite.","http://www.nj.com/hudson/index.ssf/2018/05/security_video_used_to_nab_men_charged_with_steali.html"
"BERGENJ","New Jersey","Nj.com","Kevin Shea | For NJ.com","Prosecutor investigating embattled Mercer County jail","The correction center's two wardens were recently accused in a lawsuit of trying to force a colleague into a sexual threesome","http://www.nj.com/mercer/index.ssf/2018/01/jail_wardens_ot_is_out_of_control_union_says_in_co.html"
"BERGENJ","New Jersey","Nj.com","Michaelangelo Conte | The Jersey Journal","Almost one million dollars in 'high-grade' pot seized, man charged: prosecutor","A North Bergen man has been arrested and 200 pounds of high-grade marijuana was seized following an investigation by the Hudson County Prosecutor's Office, which also recovered $100,000 and a gun.","http://www.nj.com/jjournal-news/index.ssf/2017/11/almost_one_million_dollars_in.html"
"BERGENJ","New Jersey","Nj.com","Ryan Dunleavy | NJ Advance Media for NJ.com","Here is Giants star's Janoris Jenkins' brother's rap sheet | 7 prior arrests","William Jenkins is charged with aggravated manslaughter related to a body found at home of Giants star Janoris Jenkins. William Jenkins has a lengthy criminal history, records show.","https://www.nj.com/giants/index.ssf/2018/06/here_is_giants_stars_janoris_jenkins_brothers_rap.html"
"BERGENJ","New Jersey","Nj.com","Taylor Tiamoyo Harris | NJ Advance Media for NJ.com","Janoris Jenkins' brother is a person of interest after body found in NFL player's home","According to Ontario County District Attorney James Ritt, William Jenkins was arrested around 1:30 a.m. Tuesday on an outstanding warrant.","https://www.nj.com/bergen/index.ssf/2018/06/brother_of_nfl_player_named_person_of_interest_for.html"
"BERGENJ","New Jersey","Nj.com","Michaelangelo Conte | The Jersey Journal","Bergen man charged with hitting cop with Cadillac in Weehawken","A 24-year-old Ridgefield man has been charged with aggravated assault for allegedly striking a police officer with his vehicle after being pulled over in Weehawken on Tuesday, officials said.","http://www.nj.com/hudson/index.ssf/2018/05/man_charged_with_striking_cop_with_cadillac_in_wee.html"
"BERGENJ","New Jersey","Nj.com","Michaelangelo Conte | The Jersey Journal","Union City man caught driving a car stolen in Weehawken, cops say","A Union City man was arrested in North Bergen on Saturday where police say he was driving a car that was reported stolen in Weehawken a few days earlier.","http://www.nj.com/hudson/index.ssf/2018/04/union_city_man_caught_driving_a_car_stolen_in_weeh.html"
"BERGENJ","New Jersey","Nj.com","Michaelangelo Conte | The Jersey Journal","Security cameras have their revenge after men try smashing them: North Bergen police","There was a good reason two alleged crooks tried to steal or destroy security cameras at a Hudson County dump site. The footage from the North Bergen facility's cameras caught them in the act, a criminal complaint said.","http://www.nj.com/jjournal-news/index.ssf/2018/05/security_cameras_have_their_re.html"
"BERGENJ","New Jersey","Nj.com","Anthony G. Attrino | NJ Advance Media for NJ.com","Man charged with buying AK-47, AR-15s in Pa., selling them in N.J.","Andrew Okie, 24, of Tobyhanna, Pennsylvania faces several firearms charges","http://www.nj.com/bergen/index.ssf/2018/05/man_charged_with_buying_assault_rifles_in_pa_selli.html"
"BERGENJ","New Jersey","Nj.com","Michaelangelo Conte | The Jersey Journal","North Bergen man charged with having sex with minor: complaint","A 20-year-old North Bergen man has been charged with sexually assaulting a 14-year-old girl he met at a Christmas party and later sent an Uber car to pick her up and take her to a Union City location where the incident occurred.","http://www.nj.com/hudson/index.ssf/2018/03/man_charged_with_sexually_assaulting_14-year-old_g.html"
"BERGENJ","New Jersey","Nj.com","Michaelangelo Conte | The Jersey Journal","N. Bergen man charged with having sex with minor","A 20-year-old North Bergen man has been charged with having sex with an underage girl he met at a Christmas party, authorities said.","http://www.nj.com/jjournal-news/index.ssf/2018/03/n_bergen_man_charged_with_havi.html"
"BERGENJ","New Jersey","Nj.com","Michaelangelo Conte | The Jersey Journal","North Bergen man charged with stabbing stranger multiple times","A 41-year-old North Bergen man was arrested last week on charges he stabbed a stranger multiple times while threatening to kill him, officials said.","http://www.nj.com/jjournal-news/index.ssf/2018/02/north_bergen_man_charged_with_24.html"
"BERGENJ","New Jersey","Nj.com","Michaelangelo Conte | The Jersey Journal","North Bergen man charged with stabbing stranger multiple times","A 41-year-old North Bergen man was arrested Tuesday on charges he stabbed a stranger multiple times while threatening to kill him last week, officials said.","http://www.nj.com/hudson/index.ssf/2018/02/north_bergen_man_charged_with_stabbing_stranger.html"
"BERGENJ","New Jersey","Nj.com","Michaelangelo Conte | The Jersey Journal","North Bergen cops grab man in shoplifting gone bad, officials say","A 37-year-old North Bergen man was arrested after a struggle as he tried to leave the CVS Pharmacy on Bergenline Avenue with $138 worth of beauty products on him, officials said.","http://www.nj.com/hudson/index.ssf/2018/03/man_charged_with_robbing_cosmetics_in_north_bergen.html"
"BERGENJ","New Jersey","Nj.com","Michaelangelo Conte | The Jersey Journal","North Bergen cops grab man in shoplifting gone bad, officials say","A 37-year-old North Bergen man was arrested after a struggle as he tried to leave the CVS Pharmacy on Bergenline Avenue with $138 worth of beauty products he didn't pay for, officials said.","http://www.nj.com/jjournal-news/index.ssf/2018/03/north_bergen_cops_grab_man_in.html"
"BERGENJ","New Jersey","Nj.com","Anthony G. Attrino | NJ Advance Media for NJ.com","3 men raped helpless unconscious woman, cops say","Rene Jimenez, 29, Luis Tenecela, 20, and Emeterio Castelan, 35, all of East Rutherford, are charged.","http://www.nj.com/bergen/index.ssf/2018/02/restaurant_workers_accused_of_sexually_assaulting.html"
"BERGENJ","New Jersey","Nj.com","Patrick Villanova | The Jersey Journal","Jersey Journal front and back page news: Thursday, January 18, 2018","Patrick Villanova | The Jersey Journal&nbsp; The death of a 48-year-old woman at the medical ward inside Hudson County jail has been ruled a suicide after an \"abundant amount of foreign material\" was found inside her stomach, her autopsy report...","http://www.nj.com/hudson/index.ssf/2018/01/jersey_journal_front_and_back_page_news_thursday_j_39.html"
"BERGENJ","New Jersey","Nj.com","Anthony G. Attrino | NJ Advance Media for NJ.com","Man charged with DWI, assault after crash leaves pedestrian critical","Patrick Maurikos, 65, of Garfield was accused being drunk when his car hit a pedestrian, officials said.","http://www.nj.com/bergen/index.ssf/2017/10/man_charged_with_dwi_assault_after_crash_leaves_pe.html"
"BERGENJ","New Jersey","Nj.com","Caitlin Mota | The Jersey Journal","Will suspect in fatal hit-and-run be held in jail?","The 36-year-old man who allegedly fatally struck a woman while she sat at a North Bergen bus stop is due in court after turning himself into police Monday morning.","http://www.nj.com/hudson/index.ssf/2017/10/will_suspect_in_fatal_hit-and-run_be_held_in_jail.html"
"BERGENJ","New Jersey","Nj.com","Allison Pries | NJ Advance Media for NJ.com","Taxi driver arrested with $800K worth of crystal meth, cops say","The suspect had 10 pounds of the drug and 4 grams of cocaine, police say","http://www.nj.com/bergen/index.ssf/2018/01/taxi_driver_arrested_with_nearly_1_mil_worth_of_dr.html"
"BERGENJ","New Jersey","Nj.com","Anthony G. Attrino | NJ Advance Media for NJ.com","Arrest made in hit-and-run death of pedestrian in Bergen County","Brandon Bialek, 32, of Lodi is charged in the death of Brian Rossi, 28, of Teaneck.","http://www.nj.com/bergen/index.ssf/2018/02/man_held_in_hit-and-run_death_of_pedestrian_in_ber.html"
"BERGENJ","New Jersey","Nj.com","Michaelangelo Conte | The Jersey Journal","Samurai sword and drugs found in vehicle after Secaucus traffic stop: cops","A samurai sword and a variety of suspected drugs were found in a vehicle after Secaucus police pulled over a 20-year-old North Bergen man last week on Paterson Plank Road, officials said.","http://www.nj.com/hudson/index.ssf/2018/06/samurai_sword_and_drugs_found_in_vehicle_after_sec.html"
"BERGENJ","New Jersey","Nj.com","Steve Strunsky | NJ Advance Media for NJ.com","Sickly former North Bergen DPW head spared jail in corruption case","A 77-year-old former public works director with heart problems, admitted he had ordered employees to do personal or political work","http://www.nj.com/hudson/index.ssf/2017/12/sickly_former_north_bergen_dpw_head_spared_jail_in.html"
"BERGENJ","New Jersey","Nj.com","Anthony G. Attrino | NJ Advance Media for NJ.com","This cyberstalker just won't stop posting a woman's naked pictures, cops say","A cyberstalker has been charged for the third time in three years with posting naked pictures of a woman he knows without her consent, authorities said.","http://www.nj.com/bergen/index.ssf/2017/11/this_cyberstalker_just_wont_stop_posting_a_womans_naked_pictures_cops_say.html"
"BERGENJ","New Jersey","Nj.com","Michaelangelo Conte | The Jersey Journal","Accused thief nabbed after cops spot stolen items at pawn shop: police","Sharp-eyed Jersey City Police Detective Jose Santana recognized items taken during an August burglary while conducting an unrelated investigation in a pawn shop and it led to an arrest this week.","http://www.nj.com/jjournal-news/index.ssf/2017/12/accused_thief_nabbed_after_cop.html"
"BERGENJ","New Jersey","Nj.com","Michaelangelo Conte | The Jersey Journal","Thief nabbed after cops spot stolen items at pawn shop: police","Sharp-eyed Jersey City Police Det. Jose Santana recognized items taken during an August burglary while conducting an unrelated investigation in a pawn shop and it led to an arrest this week.","http://www.nj.com/hudson/index.ssf/2017/12/jersey_city_man_sold_stolen_jewelry_to_pawn_shop_c.html"
"BERGENJ","New Jersey","Nj.com","Michaelangelo Conte | The Jersey Journal","Virginia man charged with sexually assaulting girl in North Jersey 2 years ago","A 25-year-old Virginia man has been arrested two years after he allegedly sexually assault a 13-year-old girl in North Bergen after the pair met on a social media video, voice and chat app called Tango.","http://www.nj.com/hudson/index.ssf/2018/04/virginia_man_charged_with_sexually_assaulting_girl.html"
"BERGENJ","New Jersey","Nj.com","Michaelangelo Conte | The Jersey Journal","Virginia man charged with sexually assaulting girl in North Jersey 2 years ago","A 25-year-old Virginia man has been arrested two years after he allegedly sexually assaulted a 13-year-old girl in North Bergen after the pair met through social media.","http://www.nj.com/jjournal-news/index.ssf/2018/04/virginia_man_charged_with_sexu.html"
"BERGENJ","New Jersey","Nj.com","Michaelangelo Conte | The Jersey Journal","Cops interrupt heroin sale, charge 19-year-old: authorities","A Jersey City teen was charged with dealing heroin Saturday when police conducting surveillance interrupted a sale in an area known for drug trafficking, authorities said.","http://www.nj.com/jjournal-news/index.ssf/2018/03/cops_interrupt_heroin_sale_cha.html"
"BERGENJ","New Jersey","Nj.com","Michaelangelo Conte | The Jersey Journal","Cops interrupt heroin sale, charge 19-year-old: authorities","Twenty bags of suspected heroin with the logo \"Gucci\" got a 19-year-old Jersey City man locked up by officers conducting surveillance in an area known for drug trafficking on Grant Avenue Saturday.","http://www.nj.com/hudson/index.ssf/2018/03/heroin_with_gucci_logo_leads_to_arrest_cops_say.html"
"BERGENJ","New Jersey","Nj.com","Allison Pries | NJ Advance Media for NJ.com","Twin brothers arrested in fatal Moonachie hit-and-run","Twin brothers have been arrested in a January hit-and-run on Route 46","http://www.nj.com/bergen/index.ssf/2018/02/twin_brothers_arrested_in_fatal_moonachie_hit-and-.html"
"BERGENJ","New Jersey","Nj.com","Michaelangelo Conte | The Jersey Journal","Man accused in fatal hit-run now facing $500G money laundering charge","A New York man charged with leaving the scene of a fatal North Bergen accident last week has now been charged with money laundering in an amount in excess of $500,000.","http://www.nj.com/hudson/index.ssf/2017/10/post_925.html"
"BERGENJ","New Jersey","Nj.com","Michaelangelo Conte | The Jersey Journal","Guilty plea in 2014 hit-and-run that killed man, injured brother","A 41-year-old Guatemala native will face 15 years in prison after pleading guilty Wednesday to the aggravated manslaughter of a 20-year-old man in a 2014 North Bergen hit-and-run.","http://www.nj.com/jjournal-news/index.ssf/2018/01/guilty_plea_in_2014_hit-and-ru.html"
"BERGENJ","New Jersey","Nj.com","Michaelangelo Conte | The Jersey Journal","Guatemalan national gets 15 years for fatal North Bergen hit-and-run","A 41-year-old Guatemala native was sentenced to 15 years in prison today for the aggravated manslaughter of a 20-year-old man in a 2014 North Bergen hit-and-run and the aggravated assault of the victim's 11-year-old brother.","http://www.nj.com/hudson/index.ssf/2018/05/guatemalan_national_gets_15_years_for_fatal_north.html"
"BERGENJ","New Jersey","Nj.com","Kevin Shea | For NJ.com","Man charged with killing N.J. brothers arrested in California","Quan Harmon and Quamir Harmon were killed last month in Newark","http://www.nj.com/essex/index.ssf/2018/05/man_charged_with_killing_nj_brothers_arrested_in_c.html"
"BERGENJ","New Jersey","Nj.com","Michaelangelo Conte | The Jersey Journal","Man knocked out by brother, jaw broken in three places, cops say","Jersey City man was knocked out cold and had his jaw broken following an argument with his 49-year-old brother on Sunday, officials said.","http://www.nj.com/hudson/index.ssf/2018/05/man_knocked_out_by_brother_has_jaw_broken_in_three.html"
"BERGENJ","New Jersey","Nj.com","Caitlin Mota | The Jersey Journal","4th suicide at jail in less than one year, and the details are disturbing","Less than 48 hours after telling police he wanted to jump off a bridge during a West New York arrest, a 26-year-old man was found hanging in his jail cell yesterday morning.","http://www.nj.com/jjournal-news/index.ssf/2018/03/4th_suicide_at_jail_in_less_th.html"
"BERGENJ","New Jersey","Nj.com","Caitlin Mota | The Jersey Journal","4th suicide at jail in less than one year, and the details are disturbing","Less than 48 hours after telling police he wanted to jump off a bridge during a West New York arrest, a 26-year-old man was found hanging in his jail cell on Sunday morning.","http://www.nj.com/hudson/index.ssf/2018/03/man_found_hanging_in_cell_sunday_morning_is_4th_su.html"
"BERGENJ","New Jersey","Nj.com","Anthony G. Attrino | NJ Advance Media for NJ.com","Teacher's aide charged with sexually assaulting juvenile","Phillip Cerone, 27, of Maywood is charged with sexual assault and 2 counts of endangering the welfare of a child.","http://www.nj.com/bergen/index.ssf/2017/10/teachers_aide_charged_with_sexually_assaulting_juv.html"
"BERGENJ","New Jersey","Nj.com","Michaelangelo Conte | The Jersey Journal","$500K money laundering charge for man accused in fatal hit-and-run","A New York man charged with leaving the scene of a fatal North Bergen accident last week has now been charged with laundering more than $500,000.","http://www.nj.com/jjournal-news/index.ssf/2017/10/nj_adds_500g_money_laundering.html"
"BERGENJ","New Jersey","Nj.com","Caitlin Mota | The Jersey Journal","Man pleads guilty to fatal bus stop hit-run","A New York man has admitted to fatally striking a woman with a vehicle while she sat at a bus stop outside her job in North Bergen last year.","http://www.nj.com/jjournal-news/index.ssf/2018/03/man_pleads_guilty_to_fatal_bus.html"
"BERGENJ","New Jersey","Nj.com","Ron Zeitlinger | The Jersey Journal","Paterson woman charged with spending spree on stolen credit card: police","A Paterson woman went on a spending spree with credit cards she stole from a co-worker at a Secaucus business, police said.","http://www.nj.com/hudson/index.ssf/2018/03/hold_paterson_woman_charged_with_spending_spree_on.html"
"BERGENJ","New Jersey","Nj.com","Ron Zeitlinger | The Jersey Journal","Paterson woman went on spending spree with stolen credit card: Secaucus police","A Paterson woman went on a spending spree with a credit card she stole from a co-worker at a Secaucus business, police said.","http://www.nj.com/jjournal-news/index.ssf/2018/04/paterson_woman_went_on_spendin.html"
"BERGENJ","New Jersey","Nj.com","Caitlin Mota | The Jersey Journal","Inmate dies two days after attempting suicide at Hudson County jail","Cynthia Acosta was found hanging early Sunday morning.","http://www.nj.com/hudson/index.ssf/2018/01/inmate_dies_two_days_after_attempting_suicide_at_h.html"
"BERGENJ","New Jersey","Nj.com","Michaelangelo Conte | The Jersey Journal","2 women arrested, more cash seized as fatal hit-and-run case takes another turn","The mystery of who Olvy Torres is has deepened with more arrests and seizure of hundreds of thousands of dollars and gold, on top of $1 million and diamonds in his possession before his arrest on charges he fled a Sept. 26 fatal North Bergen crash, officials …","http://www.nj.com/hudson/index.ssf/2017/11/the_mystery_of_man_charge_in_hit_and_run_deepens_w.html"
"BERGENJ","New Jersey","Nj.com","Michaelangelo Conte | The Jersey Journal","Jersey City man drinking a beer on the street arrested with 95 bags of heroin, police say","Jersey City police patrolling an area known for drug offenses, disorderly groups and drinking in public arrested a 38-year-old man on charges related 94 bags of suspected heroin with the logo \"Warrior\" and one with the logo \"Thriller.\"","http://www.nj.com/hudson/index.ssf/2017/12/jersey_city_drinking_a_beer_on_the_street_arrested.html"
"BERGENJ","New Jersey","Nj.com","Anthony G. Attrino | NJ Advance Media for NJ.com","Teacher may serve less than a year for crash that left cop disabled","A teacher who was allegedly drunk when he slammed into a patrol car sentenced to four years in prison, but may be eligible for parole in under a year.","http://www.nj.com/bergen/index.ssf/2018/01/teacher_may_serve_less_than_a_year_for_crash_that_left_cop_disabled.html"
"BERGENJ","New Jersey","Nj.com","Anthony G. Attrino | NJ Advance Media for NJ.com","Worker accused of kidnapping, robbing new boss to pay child support","Luis Vasconez, 37, of North Bergen, is accused of kidnapping his manager in Hackensack because he needed money for child support","http://www.nj.com/bergen/index.ssf/2018/05/i_have_nothing_to_lose_man_tells_boss_before_kidna.html"
"BERGENJ","New Jersey","Nj.com","Michaelangelo Conte | The Jersey Journal","Arizona man arrested in N.J. with 9 pounds of heroin, cops say","The officers found nearly 9 pounds of heroin inside the man's car, authorities said.","http://www.nj.com/hudson/index.ssf/2017/11/arizona_man_arrested_in_north_bergen_with_4_kilos.html"
"BERGENJ","New Jersey","Nj.com","Michaelangelo Conte | The Jersey Journal","Man facing multiple drug charges after stealing a bottle of water, cops say","A man accused of stealing a bottle of water from a gas station is also facing drug charges after police found 27 bags of suspected heroin on him while making the arrest, authorities said.","http://www.nj.com/jjournal-news/index.ssf/2017/11/man_facing_multiple_drug_charg.html"
"BERGENJ","New Jersey","Nj.com","Michaelangelo Conte | The Jersey Journal","N.J. man admits suffocating girlfriend in heat of argument","A Jersey City man pleaded guilty to aggravated manslaughter yesterday and admitted covering his girlfriend's nose and mouth with his hands and suffocating her during an argument in the Heights in April.","http://www.nj.com/jjournal-news/index.ssf/2017/10/nj_man_admits_suffocating_girl.html"
"BERGENJ","New Jersey","Nj.com","Michaelangelo Conte | The Jersey Journal","Man facing multiple drug charges after stealing a bottle of water, cops say","A search revealed Ortega had the suspected heroin in his jacket pocket, the complaint states.","http://www.nj.com/hudson/index.ssf/2017/11/man_facing_multiple_drug_charges_after_allegedly_s.html"
